{
  "apiVersion": "mender.io/plugin/v1alpha1",
  "plugin_id": "example.company-search",
  "version": "1.0.0",
  "publisher_id": "publisher_example",
  "display_name": "Example company search",
  "description": "A governed bundle of already reviewed Mender capabilities.",
  "capabilities": [
    {
      "kind": "api_tool",
      "tool_version_id": "toolv_company_search_v1"
    },
    {
      "kind": "mcp_tool",
      "tool_version_id": "toolv_company_search_mcp_v1"
    },
    {
      "kind": "agent",
      "deployment_revision": "deployment_company_research_agent_v1"
    }
  ]
}
